{
  "schema_version": 1,
  "manifest_id": "codex-evidence-2026-08-15-candidate",
  "adapter_id": "codex",
  "ads_id": "codex-ads-2026-08-15-candidate",
  "sanitizer": { "version": 1, "prohibited_scan": "pass", "raw_capture_committed": false },
  "claims": [
    {
      "claim_id": "codex-artifact-target-open",
      "statement": "The rollout family is recognizable, but the current Codex distributable and version range have not been pinned for support promotion.",
      "state": "open",
      "sources": [
        { "kind": "code_reference", "path": "crates/spaghetti-napi/src/codex/adapter.rs", "sha256": null, "locator": "CodexAdapter::new manifest" }
      ]
    },
    {
      "claim_id": "codex-source-observed",
      "statement": "The current Rust adapter reads bounded append-delimited rollout JSONL beneath the configured sessions root.",
      "state": "observed",
      "sources": [
        { "kind": "code_reference", "path": "crates/spaghetti-napi/src/codex/adapter.rs", "sha256": null, "locator": "AgentAdapter::discover and AgentAdapter::streams" }
      ]
    },
    {
      "claim_id": "codex-identity-open",
      "statement": "Session_meta identity and cwd association are implemented, but move, clone, reuse, and adversarial conflict claims lack independent fixtures.",
      "state": "degraded",
      "sources": [
        { "kind": "code_reference", "path": "crates/spaghetti-napi/src/codex/adapter.rs", "sha256": null, "locator": "decode_session_meta and entity_keys" }
      ]
    },
    {
      "claim_id": "codex-semantic-fixtures-open",
      "statement": "Independent sanitized fixtures for history, usage, model, compaction, reset, and unknown records remain to be authored.",
      "state": "open",
      "sources": [
        { "kind": "design_record", "path": "docs/rfcs/012a-agent-adaptation-and-engine-boundaries.md", "sha256": null, "locator": "Standard adaptation workflow" }
      ]
    },
    {
      "claim_id": "codex-scope-open",
      "statement": "A one-object rollout scope is bounded in declaration but not yet connected to the common observer or lifecycle conformance.",
      "state": "open",
      "sources": [
        { "kind": "design_record", "path": "docs/rfcs/012d-session-scoped-observation.md", "sha256": null, "locator": "Common scoped observation contract" }
      ]
    },
    {
      "claim_id": "codex-privacy-policy",
      "statement": "Raw captures are private and any future committed Codex fixtures must be deterministic synthetic or sanitized evidence.",
      "state": "observed",
      "sources": [
        { "kind": "design_record", "path": "docs/rfcs/012a-agent-adaptation-and-engine-boundaries.md", "sha256": null, "locator": "Security and privacy" }
      ]
    }
  ]
}
